Lemma,Glossa,Esempio,POS
wagnerita,"Membro del Gruppo Wagner, una compagnia paramilitare di mercenari che opera per conto di alte autorità russe.","In ogni campo militare Wagner c’è un container dove vengono portati e torturati i soldati da punire, hanno raccontato alcuni wagneriti",sost
welfareggiare,"##forestierismo## Agire, spesso con un'accezione ironica, per promuovere o estendere le politiche di welfare dello Stato sociale.","Primum salvare le banche, deinde welfareggiare (con moderazione, stante l’ormai prossimo obbligo costituzionale del pareggio di bilancio)",verb
wise working," ##forestierismo## Modello lavorativo che valorizza la relazione tra azienda e dipendenti, offrendo non solo retribuzioni economiche ma anche opportunità di crescita personale e professionale, e di contributo a progetti con impatti benefici in ambiti sociali, culturali ed ambientali.",È evidente che il sistema del wise working richiede un passaggio di paradigma nell’attività aziendale e non solo,loc nom
yolo economy,"Concetto economico e sociale che vede soprattutto i giovani scegliere di evitare o abbandonare impegni lavorativi e di vita ritenuti insoddisfacenti o troppo gravosi, in cerca di alternativi stili di vita che privilegino il benessere personale e la soddisfazione.","Yolo economy, un italiano su tre vuole cambiare lavoro",loc nom
torpore sintetico,"Nel contesto della ricerca medica e scientifica, pratica di induzione di uno stato di torpore in un essere umano attraverso la riduzione controllata della temperatura corporea.",Negli ultimi anni sono stati fatti passi in avanti per indurre il torpore sintetico in una specie che non iberna. Ma la strada per un’eventuale applicazione all’uomo è ancora lunga.,loc nom